<!DOCTYPE employees SYSTEM "employees.dtd">
<employees>
    <employee empId="e1">
        <firstName>John</firstName>
        <lastName>Smith</lastName>
        <startDate>01/02/1998</startDate>
        <endDate>06/12/2020</endDate>
        <paycheck id="p1" rate="15.00" hours="20" taxes="31.34" sickHoursAccrued="8" overtimeHours="0" netPay="268.66" sickHoursUsed="0" />
    </employee>
    <employee empId="e2">
        <firstName>John</firstName>
        <lastName>Smith</lastName>
        <startDate>01/02/1998</startDate>
        <endDate>06/12/2020</endDate>
    </employee>
</employees>